company_name,website,sector,contact_name,email,phone,linkedin,location,employee_count,source,ai_score,ai_reason,tag,google_rating
Bridget McConnell,http://bridgetmcconnell.com/,Holistic health practitioner,,,07512 284620,,"Surrey, The Holistic Centre",,Google Places,8,Suitable for client-facing health/wellness practices,wellness,,ChIJl1JvRdLRdUgRaf4yl-JuQH0,Godalming
Alex Churchley Cook Psychodynamic Psychotherapist,,Psychotherapy,,,07767 352221,,"Catteshal Milll, Godalming GU7 1NJ, UK",,Google Places,9,Suitable for client-facing therapy in a quiet professional space,wellness,,ChIJU-n7XTDQdUgRK_vxga3syHY,Godalming
"Dr Keric Allenbrook, Chiropractor",,Chiropractic,,,07532 773731,,"West Clandon, Guildford GU4 7TT, UK",,Google Places,9,Chiropractors require clinical space for client consultations and treatments.,clinic-target,5/5 (1 reviews),ChIJjdIzBnbRdUgR8ShyWx3RNig,Guildford
Laphin Thai Therapy,http://www.laphinthaitherapy.co.uk/,Massage Therapy,,,07785 935415,,"13 Woodruff Ave, Guildford GU1 1XS, UK",,Google Places,9,"Massage therapy requires a quiet, professional space for client treatments.",wellness,5/5 (28 reviews),ChIJA9oODKHbdUgRnuJwjrKO6vU,Guildford
More Than Muscle Ltd,https://www.morethanmuscle.co.uk/,Fitness & Wellness,,,01483 363161,,"Stoke Rd, Guildford GU1 1EZ, UK",,Google Places,5,Fitness-focused business that may outgrow the space,wellness,5/5 (133 reviews),ChIJZ2RTW7kcdkgRemm4qhl8Q9I,Guildford
The Inner Health Practice,http://www.theinnerhealthpractice.co.uk/,Health & Wellness,,,07735 615651,http://www.linkedin.com/in/rebeccajohnson5,"29 East St, Farnham GU9 7TP, UK",,Google Places,8,Suitable for client-facing health and wellness practices,wellness,,ChIJK4sUg6otdEgRqQmgyBB-zEg,Farnham
Laney Randell,,Physiotherapy,,,01483 768587,,"Golf Club Rd, Woking GU22 0LS, UK",,Google Places,9,Physiotherapy requires a clinical space for client treatment.,clinic-target,5/5 (4 reviews),ChIJ46s6UJ_XdUgRtZhrMAh1rqQ,Woking
ProHealth Osteopaths,https://prohealthosteopaths.co.uk/,Osteopathy,,,07389 140146,,"29, West Byfleet KT14 6RN, UK",,Google Places,9,"ProHealth Osteopaths requires clinical space for their practice, making them highly suitable for Unit 8.",clinic-target,5/5 (3 reviews),ChIJS-_1ue_ZdUgRO1NntGrCATg,Woking
AD Laboratories,http://www.adlaboratories.co.uk/,Health & Wellness,,,01483 722994,,"Guildford Rd, Woking GU22 7QU",,Google Places,5,Wellness focus but may be larger than suitable for Unit 8,wellness,4.8/5 (17 reviews),ChIJrx32eSjYdUgRj2AN6BnvxVo,Woking
"York House Dental Practice - West Byfleet, Surrey",https://www.yorkhousedentalpractice.co.uk/,Dental,,,01932 348864,,"Lavender Park Rd, West Byfleet KT14 6ND, UK",,Google Places,8,Private dental practice suitable for client-facing health services,clinic-target,5/5 (304 reviews),ChIJOWUIzYTYdUgRQo2eTZe65D4,Woking
New Octavia Dental Surgery,http://www.newoctaviadentalsurgery.com/,Dental,,newoctaviadentalsurgery@btconnect.com,01428 604445,,"Beacon Hill, Hindhead GU26 6NP, UK",,Google Places,8,Private dental practice suitable for client-facing health services,clinic-target,5/5 (2 reviews),ChIJpVbPgTEzdEgRBPlhfBiwZxk,Haslemere
Aberdeen House Dental Practice,http://www.winningsmile.co.uk/,Dental,,,01428 605405,,"Grayshott, Hindhead GU26 6LD, UK",,Google Places,8,Suitable for client-facing health practice with a need for professional space,clinic-target,5/5 (12 reviews),ChIJDQemw0szdEgRXzjzFV30zLo,Haslemere
Church Hill Dental Clinic,https://www.colosseumdental.co.uk/practices/church-hill-dental-clinic,Dental Practice,,reception.churchhill@colosseumdental.co.uk,01730 810010,https://www.linkedin.com/company/colosseum-dental-uk-ltd,"Church Hill, Midhurst GU29 9NX, UK",,Google Places,9,Suitable as a private dental practice requiring a professional space for client interactions.,clinic-target,4.8/5 (152 reviews),ChIJbXEnNDS1dUgROOxQmjMSBao,Haslemere
Weyshot Dental Laboratory,http://www.weyshotdentallaboratory.co.uk/,Dental Laboratory,,,01428 658249,,"6 Linchmere Rd, Haslemere GU27 3QF, UK",,Google Places,4,Dental laboratory services are not client-facing and do not require a professional space for consultations.,clinic-target,5/5 (1 reviews),ChIJ6_Dkq1LLdUgR6PxeE_92DOg,Haslemere
Crofts Veterinary Surgery - Haslemere,https://www.croftsvetsurgery.co.uk/,Veterinary,,,01428 653056,,"Petworth Rd, Haslemere GU27 2HU, UK",,Google Places,1,Veterinary practices require specialized facilities and are not suitable for a small clinical space like Unit 8.,wellness,4.9/5 (139 reviews),ChIJI_SmJoPLdUgRW9FXzEqCp9w,Haslemere
Aligned Insights RTT Hypnotherapy & Human Design,https://www.alignedinsights.co.uk/,Hypnotherapy,,,07875 683084,,"Grayshott, Haslemere, Junipers GU26 6JF",,Google Places,8,Suitable for client-facing health and wellness practices like hypnotherapy.,wellness,5/5 (13 reviews),ChIJVwipGUsZa0gRJwoN7bsgQdQ,Haslemere
Priory Hospital Mildmay Oaks,https://www.priorygroup.com/locations/nhs/priory-hospital-mildmay-oaks?utm_source=google_my_business&utm_medium=organic&utm_campaign=nhs&utm_content=priory-hospital-mildmay-oaks,hospital,,,01252 845826,,"Winchfield, Hook RG27 8BS, UK",,Google Places,1,NHS or public sector clinic,clinic-target,3.8/5 (4 reviews),ChIJib2DeOwodEgReeQGNd27Xk0,Milford
"Neurofeedback - Neurointegra Ash, Guildford",http://www.neurointegra.co.uk/,Neurofeedback therapy,,,01252 433993,,"4A High St, Bramley, Guildford GU5 0HB",,Google Places,8,Suitable for client-facing health practices focusing on mental wellness,wellness,5/5 (11 reviews),ChIJ12DWyIbRdUgRm2ku49323gA,Milford
Nutritionist Resource,https://www.nutritionist-resource.org.uk/,Nutritionists,,,0333 325 2504,https://www.linkedin.com/company/nutritionist-resource,"Building B, Camberley GU15 3YL, UK",,Google Places,6,"Currently home-based, could benefit from a professional space upgrade.",wellness,4.9/5 (8 reviews),ChIJNaj_hrcqdEgRLpF2C87WhWw,Milford
Wellface® - Aesthetics Clinic,https://www.wellface.com/,Aesthetics Clinic,,,01932 690800,,"54 Quarry St, Guildford GU1 3UA, UK",,Google Places,9,"Aesthetics clinics require a professional and quiet space for client consultations and treatments, making Unit 8 highly suitable.",wellness,5/5 (28 reviews),ChIJAQALwJDQdUgRJOOKD6MpFY8,Guildford,unit8
Child Mental Health Clinic,http://www.cmhclinic.co.uk/,Mental Health Clinic,,,07856 193273,,"377 - 399 London Rd, Camberley GU15 3HL, UK",,Google Places,9,Suitable for client-facing mental health services in a professional space,clinic-target,5/5 (4 reviews),ChIJ03sbMwAtdEgR8Mj9RMiH1N0,Farnham,unit8
Autism Assessments Farnham,http://autismassessmentsfarnham.co.uk/,Mental health assessments,,,07387 697876,,"Leigh Ln, Farnham GU9 8HP, UK",,Google Places,8,Suitable for client-facing health assessments and therapy sessions,wellness,5/5 (18 reviews),ChIJI6on1B0tdEgRGyBduzPQizM,Farnham,unit8
Gc sport injury,,Massage Therapy,,,07812 197740,,"37 Meadway Dr, Woking GU21 4TD, UK",,Google Places,9,Ideal for client-facing massage therapy in a quiet professional space.,wellness,5/5 (9 reviews),ChIJIUXDlqzXdUgRjgLAW4nvQts,Woking,unit8
The welness tree,http://thewellnesstreegroup.com/,Health & Wellness,,,01403 740128,,"W Chiltington Ln, Billingshurst RH14 9EA, UK",,Google Places,6,Wellness-focused but may not require clinical space,wellness,4.2/5 (5 reviews),ChIJb8qA4WOcd0gR7Msr0qXVmyQ,Cranleigh,unit8
community centre,,community health,,,,,"Victoria Rd, Cranleigh GU6 8NT, UK",,Google Places,1,"Large community centres typically serve many clients and may not fit in a small, quiet space.",wellness,,ChIJx9sL_NrFdUgRzLwsKGtswis,Cranleigh,unit8
DS Sports Therapy,http://www.dssportstherapy.co.uk/,Physiotherapy,,danielle@dssportstherapy.co.uk,07871 476651,,"Hurtmore, Godalming GU8 6AD, UK",,Google Places,9,Physiotherapy requires a clinical space for client treatment.,clinic-target,5/5 (50 reviews),ChIJ00-S_uHQdUgRHmboO2JX9DU,Compton,unit8
Seventy9 Sports Therapy,https://seventy9sportstherapy.co.uk/,Massage Therapy,,,07725 469947,https://www.linkedin.com/company/seventy9-sports-therapy/,"Worplesdon, Guildford GU3 3PE, UK",,Google Places,9,"Massage therapy requires a quiet, professional space for client interactions.",wellness,4.9/5 (44 reviews),ChIJV3fGZ9ctdEgRxzvwaWET8_8,Compton,unit8
Ebenau Physiotherapy,http://ebenauphysio.com/,Physiotherapy,,,07967 806643,,"Milford Rd, Elstead",,Google Places,9,Physiotherapy requires a clinical space for client treatment.,clinic-target,5/5 (3 reviews),ChIJw6xLKHrSdUgR7EDydYPAyNA,Compton,unit8
Complete Physiotherapy,http://www.completephysiotherapy.co.uk/,Physiotherapy,,,0118 946 2299,,"Caversham, Reading RG4 7QF, UK",,Google Places,9,"Complete Physiotherapy requires clinical space for client treatment, making it highly suitable.",clinic-target,4.9/5 (114 reviews),ChIJc4VdI6-bdkgR8-bX2j7hZcg,Compton,unit8
Surrey Clinical Care Services,https://surreyclinicalcareservices.co.uk/,Physiotherapy,,,01276 459049,,"37 Upper Gordon Rd, Camberley GU15 2HJ, UK",,Google Places,9,"Physiotherapy requires clinical space, making it highly suitable for Unit 8.",clinic-target,4.1/5 (13 reviews),ChIJa0EsXVDVdUgRpeUaFmvaoe4,Compton,unit8
Bookham Chartered Physiotherapy Service,http://www.bookham-physiotherapy.co.uk/,Physiotherapy,,,01372 360175,,"Fetcham, Leatherhead KT22 9LG, UK",,Google Places,9,"Physiotherapy requires a clinical space, making it highly suitable for Unit 8.",clinic-target,5/5 (5 reviews),ChIJgYHdx_LgdUgRRKKLoZ2yzmg,Compton,unit8
Elite Performance Physiotherapy,https://www.eliteperformancephysiotherapy.co.uk/,Physiotherapy,,Info@eliteperformancephysiotherapy.co.ukOr,07714 847127,,"23 Craven Rd, Reading RG1 5LE, UK",,Google Places,9,Requires clinical space for client treatments,clinic-target,5/5 (2 reviews),ChIJYfD1V5ibdkgRa7AmjIrD7aI,Compton,unit8
Square One Physiotherapy Clinic,http://www.square-one.uk.com/,Physiotherapy,,info@square-one.uk.com,01256 541515,,"North Warnborough, Hook RG29 1DU, UK",,Google Places,9,"Physiotherapy requires a clinical space, making it highly suitable for Unit 8.",clinic-target,4.9/5 (30 reviews),ChIJxUP-0PwldEgR17Tg1adUhFc,Compton,unit8
Pringle Physiotherapy,https://pringlephysiotherapy.co.uk/,Physiotherapy,,002contact@pringlephysiotherapy.co.ukFacebook,01306 264002,,"Holmbury St Mary, Dorking RH5 6NA, UK",,Google Places,9,"Physiotherapy requires a clinical space, making it highly suitable for Unit 8.",clinic-target,,ChIJbTVxAhbDdUgRdIhjYR7tPvA,Compton,unit8
The Hurtwood Physio,https://www.thehurtwoodphysio.co.uk/,Physiotherapy,,,07799 563604,,"Holmbury St Mary, Dorking RH5 6LG, UK",,Google Places,9,"Physiotherapy requires clinical space, making it highly suitable for Unit 8.",clinic-target,5/5 (23 reviews),ChIJid3YHv_bdUgRauSSPyMafXM,Compton,unit8
Physiotherapist - Private GP Clinic,https://www.privategpclinic.co.uk/services-physiotherapy/,Physiotherapy,,,01344 624020,,"Sunningdale, Ascot SL5 0DP, UK",,Google Places,10,Requires clinical space for client-facing services,clinic-target,5/5 (4 reviews),ChIJk7b0K-F5dkgRkjgoJPyUQ20,Compton,unit8
Momentum Physio,https://momentum-physio.co.uk/,Physiotherapy,,mark@momentum-physio.co.uk,07876 591737,,"Hamm Moor Ln, Addlestone KT15 2SD, UK",,Google Places,9,"Physiotherapy requires a clinical space, making it highly suitable for Unit 8.",clinic-target,5/5 (28 reviews),ChIJk1fPFvp3dkgRxQgmduE4XOs,Compton,unit8
Mansfield Park Physiotherapy,http://www.mansfieldparkphysio.co.uk/,Physiotherapy,,,07341 364504,,"Medstead, Alton GU34 5PZ, UK",,Google Places,9,"Physiotherapy requires a clinical space, making it highly suitable for Unit 8.",clinic-target,5/5 (23 reviews),ChIJHVKanQA9dEgRMU5xZ_36zl0,Compton,unit8
Corefitphysio,http://www.corefitphysio.com/,Physiotherapy,,westcott@corefitphysio.com,07428 480827,,"Masters House, Guildford Rd, Westcott",,Google Places,9,"Physiotherapy requires a clinical space for client treatment, making it highly suitable.",clinic-target,5/5 (28 reviews),ChIJU6AzXnnndUgRHFyyhFjK_vk,Compton,unit8
Elevate Physiotherapy,https://www.innerv8.co.uk/,Physiotherapy,,info@innerv8.co.uk,07951 977048,,"Unit 7, Bramley Hedge Farm, Redhill Rd",,Google Places,9,"Physiotherapy requires a clinical space, making it highly suitable.",clinic-target,5/5 (30 reviews),ChIJ7cRHLO3fdUgRs0Bqc_rJ3Fw,Compton,unit8
Simply Thrive Physio and Pilates,https://www.simplythrive.uk/,Physiotherapy,,,07846 128479,,"7 Attwoods Drove, Compton, Winchester SO21 2AX",,Google Places,9,"Physiotherapy requires a clinical space, making it highly suitable for Unit 8.",clinic-target,5/5 (19 reviews),ChIJq_z2KucNdEgRN-OIqrKptFM,Compton,unit8
SB Physiotherapy,http://www.sbphysiotherapy.co.uk/,Physiotherapy,,info@sbphysiotherapy.co.uk,01293 365011,,"Surrey Injury Clinic, Caledonian House",,Google Places,9,"Physiotherapy requires a clinical space, making it highly suitable for Unit 8.",clinic-target,5/5 (170 reviews),ChIJl3K3HSVW30cRODxXW4GwTF8,Compton,unit8
Tiverton House Osteopaths,http://thebodyadvocate.co.uk/,Osteopathy,,,07831 697661,,"9 Lowbury Gardens, Compton, Newbury RG20 6NN",,Google Places,9,"Osteopaths require clinical space for patient treatment, making them highly suitable for Unit 8.",clinic-target,5/5 (12 reviews),ChIJC0eKVyKmdkgRR65Ipjl2sRA,Compton,unit8
Horsley Chiropractic at Mortiboys Dental Spa,http://horsleychiropractor.co.uk/?utm_source=gmb&utm_medium=organic,Chiropractic,,,01483 281428,,"East Horsley, Leatherhead KT24 5HE, UK",,Google Places,9,"Chiropractic practice requires a clinical space, making it highly suitable for Unit 8.",clinic-target,5/5 (11 reviews),ChIJr0D6aPbedUgRZPpzc-DDy6Q,Compton,unit8
Bower Chiropractic Clinic (McTimoney Chiropractor),,Chiropractic,,,01428 715419,,"Arford, Headley GU35 8BT, UK",,Google Places,9,Chiropractic requires a clinical space for client consultations and treatments.,clinic-target,5/5 (1 reviews),ChIJVVumXcYzdEgRd1_Brgzxizc,Compton,unit8
Goodwood Spinal Health,http://www.gwspinalhealth.co.uk/,Chiropractic,,,07917 880251,,"17 Goodwood Cl, Camberley GU15 4LU, UK",,Google Places,9,Chiropractic practice requires a clinical space for client consultations and treatments.,clinic-target,5/5 (145 reviews),ChIJcxSwaf5_dkgRjib5NuAgTUU,Compton,unit8
Chiroclinic,http://www.chiroclinic.care/,Chiropractic,,,07957 237604,,"New Haw, Addlestone KT15 3NA, UK",,Google Places,9,Chiropractic requires a clinical space for client consultations and treatments.,clinic-target,5/5 (7 reviews),ChIJIy5XzYB1dkgR6FxBX_W76qM,Compton,unit8
Pro-Chiro,https://pro-chiro.co.uk/,Chiropractic,,josh@pro-chiro.co.uk,01737 817769,,"Walton on the Hill, Tadworth KT20 7RT, UK",,Google Places,9,Chiropractic practice requires clinical space for client consultations and treatments.,clinic-target,5/5 (111 reviews),ChIJPZpqFu7jdUgR9Du2lJyR5F8,Compton,unit8
UK Chiropractic New Milton,http://www.ukchiropractic.com/,Chiropractic,,,01425 622633,,"Atlas House, 7-9 Compton Rd, New Milton BH25 6EQ",,Google Places,9,Chiropractic requires clinical space for client consultations and treatments.,clinic-target,4.8/5 (93 reviews),ChIJkbKiNpuEc0gRhIW9-svKN_o,Compton,unit8
Camberley Chiropractic Clinic,http://www.camberleychiropractic.co.uk/,Chiropractic,,,01276 21637,,"Park St, Bagshot GU19 5AQ, UK",,Google Places,9,"Chiropractic requires a clinical space, making it highly suitable for Unit 8.",clinic-target,5/5 (111 reviews),ChIJN_ard54qdEgRNOUwLa_bYyA,Compton,unit8
Core & Spine,https://www.coreandspine.co.uk/,Chiropractors,,,07737 440163,,"Deepcut, Camberley GU16 6SD, UK",,Google Places,9,Chiropractic practice requires clinical space for client consultations and treatments.,clinic-target,5/5 (11 reviews),ChIJ65vhrb_VdUgRrYS0BVdY6vA,Compton,unit8
Total Health Chiropractic,http://www.totalhealthchiropractic.co.uk/,Chiropractic,,,01932 932176,,"40 Anyards Rd, Cobham KT11 2LA, UK",,Google Places,9,Chiropractic requires a clinical space for client consultations and treatments.,clinic-target,5/5 (34 reviews),ChIJH6FGXdjfdUgRovMePRWmcCc,Compton,unit8
Chevington Clinic,http://www.chevingtonclinic.co.uk/,Chiropractic,,info@chevingtonclinic.co.uk,01883 743355,,"Bletchingley, Redhill RH1 4LU, UK",,Google Places,9,Chiropractic practice requires a clinical space for client consultations and treatments.,clinic-target,4.8/5 (53 reviews),ChIJp2eebV35dUgRXrzYLM4Hciw,Compton,unit8
Hookwood Chiropractic Clinic,http://www.hookwoodchiropractic.co.uk/,Chiropractic,,enquiries@hookwoodchiropractic.co.uk,01483 808081,,"West Horsley, Leatherhead KT24 6AX, UK",,Google Places,9,"Chiropractic requires a clinical space, making it highly suitable for Unit 8.",clinic-target,5/5 (8 reviews),ChIJ1dkr0wLcdUgRKmg8ef9uR8M,Compton,unit8
The Aim Clinic,http://aimclinic.co.uk/,Health & Wellness Clinic,,,01420 479502,,"Oakhanger, Bordon GU35 9BF, UK",,Google Places,9,"The Aim Clinic focuses on health and wellness, making it suitable for client-facing practices in a professional space.",clinic-target,5/5 (5 reviews),ChIJ9fIG3cwxdEgRERk8-53HrQ4,Compton,unit8
"The Spinal Answer Chiropractor Four Marks, Alton",https://www.spinalanswer.co.uk/,Chiropractic,,,020 7736 2550,,"Four Marks, Alton GU34 5HR, UK",,Google Places,9,Chiropractic practice requires a clinical space for client consultations and treatments.,clinic-target,5/5 (8 reviews),ChIJdb8qORM8dEgRFwgk0iNk1ts,Compton,unit8
Patrick Thomas - Bordon Chiropractor,https://aimclinic.co.uk/chiropractic/,Chiropractic,,,01420 479502,,"Oakhanger, Bordon GU35 9BF, UK",,Google Places,9,"Chiropractic practice requires a small, professional clinical space for client consultations and treatments.",clinic-target,,ChIJ2xLJvmUxdEgRW3Q7zhmsmwg,Compton,unit8
Well Life Clinic - Cobham,https://www.welllife-clinic.co.uk/,Health Clinic,,hello@welllife-clinic.co.uk,01932 391883,,"5 Between Sts, Cobham KT11 1AA, UK",,Google Places,9,Health clinic suitable for client-facing health practices,clinic-target,4.2/5 (5 reviews),ChIJ53-hwnDfdUgRKcEhCebwH7k,Compton,unit8
The Hampshire Clinic,https://www.circlehealthgroup.co.uk/hospitals/the-hampshire-clinic?utm_source=google&utm_medium=googlelocal&utm_campaign=bmihampshire,health clinic,,,01256 357111,https://www.linkedin.com/company/circlehealthgroup,"Basing Rd, Basingstoke RG24 7AL, UK",,Google Places,4,Large clinic likely has more space than Unit 8 can provide,clinic-target,4.9/5 (1315 reviews),ChIJQ6WPYkIhdEgRz4CT24337YI,Compton,unit8
Virginia Water Private Medical Clinic,http://virginiawaterprivatemedicalclinic.co.uk/,Private health clinic,,,01344 842546,,"Christchurch Rd, Virginia Water GU25 4RL, UK",,Google Places,9,Private health clinic suitable for client-facing health practices,clinic-target,3.7/5 (3 reviews),ChIJvyIPFwN5dkgRRZ9rHo88Uhg,Compton,unit8
Parkside Health: Private GP Clinic Windlesham,http://www.parksidehealth.com/,Private GP Clinic,,,01276 546434,,"Windlesham, Bagshot GU20 6PB, UK",,Google Places,9,"Private GP clinics require clinical space and a professional environment, making them highly suitable for Unit 8.",clinic-target,4.9/5 (19 reviews),ChIJURl-rTN_dkgRY1-pzBHqMIQ,Compton,unit8
The Wellness Clinic Private GP Wokingham,https://www.thewellnessclinicwokingham.co.uk/,Private GP or small health clinic,,,0118 304 4909,,"15 Elms Walk, Wokingham RG40 2FE, UK",,Google Places,9,Private GP practice suitable for client-facing health services,clinic-target,4.9/5 (35 reviews),ChIJbQ8LLp-BdkgRQItwje3ooF0,Compton,unit8
The Forbury Clinic - Craven Road,http://www.theforburyclinic.co.uk/,health clinic,,,0118 315 1444,,"23 Craven Rd, Reading RG1 5LE, UK",,Google Places,9,"The Forbury Clinic is a health and wellness clinic, suitable for client-facing practices.",clinic-target,4.8/5 (66 reviews),ChIJ4Rfq4TebdkgRw_fuX-CPfSU,Compton,unit8
Private GP Clinic - Reigate,https://privategpclinic.co.uk/?utm_source=Organic&utm_medium=GMB_Listing_Reigate&utm_id=Google,Private GP or small health clinics,,,0300 124 7600,,"1 Castlefield Rd, Reigate RH2 0SA, UK",,Google Places,9,Requires clinical space for patient consultations,clinic-target,4.9/5 (54 reviews),ChIJDccC4D_ldUgRLBYmof-hHWw,Compton,unit8
Hinchley Medical Private GP and Specialist Clinics,https://www.hinchleymedical.co.uk/,Private GP or small health clinics,,info@hinchleymedical.co.uk,020 8398 1688,https://www.linkedin.com/company/hinchleymedical,"Hinchley Wood, Esher KT10 0SR, UK",,Google Places,9,Private GP clinic requiring clinical space for patient consultations,clinic-target,4.9/5 (40 reviews),ChIJ1U8o3e8LdkgRJVKaa_bvNhs,Compton,unit8
"The Berkshire Clinic - Private Medical, Surgical, GP services and diagnostic tests",http://www.theberkshireclinic.com/,Private health clinic,,,0118 304 5920,,"Winnersh, Wokingham RG41 5RB, UK",,Google Places,8,Private medical services fit well in a clinical space,clinic-target,4.9/5 (243 reviews),ChIJ4Uhd4PKFdkgRU-JD9itpZcA,Compton,unit8
The Downland Practice - Compton,http://www.downlandpractice.nhs.uk/,NHS health clinic,,,01635 248251,,"High St, Compton, Newbury RG20 6NJ",,Google Places,1,"NHS or public sector clinic, not suitable for a small professional space.",clinic-target,5/5 (3 reviews),ChIJ1ReW1k67dkgRfPDcTX6kVVo,Compton,unit8
Prime Health,http://www.prime-health.co.uk/,Health Clinic,,,0330 025 2100,,"1 Brooklands Rd, Weybridge KT13 0TJ, UK",,Google Places,9,Suitable as a health clinic requiring a professional space for client-facing services.,clinic-target,3.9/5 (48 reviews),ChIJGaHgbVTfdUgRbIjZbHVYE90,Compton,unit8
Compton Natural Health Centre,,Health & Wellness,,,07801 355259,,"Old Kiln Studios Watts Pottery, Compton, Guildford GU3 1DQ",,Google Places,8,Suitable for client-facing health/wellness practices,wellness,,ChIJlQ1V_QrRdUgRti_2D03H2_E,Compton,unit8
The Key Clinic,http://www.thekeyclinic.co.uk/,Health Clinic,,clientcare@thekeyclinic.co.uk,020 7486 4462,https://www.linkedin.com/company/the-key-clinic-ltd/,"Churn Rd, Compton, Newbury RG20 6PP",,Google Places,8,Suitable as a health clinic needing a professional space for client-facing services,clinic-target,5/5 (1 reviews),ChIJWRGZ98ildkgR2g4K8rlpLHk,Compton,unit8
Compleet Feet Podiatry,http://www.compleetfeet.co.uk/,Podiatry,,info@compleetfeet.co.uk,01420 89600,,"5a Normandy St, Alton GU34 1DD, UK",,Google Places,9,Podiatry requires a clinical space for client consultations and treatments.,clinic-target,4.5/5 (40 reviews),ChIJpUF6Z-Y6dEgRjUKWLqXvewo,Compton,unit8
Berkshire Podiatry,https://www.berkshirepodiatry.co.uk/?utm_source=google&utm_medium=wix_google_business_profile&utm_campaign=8266343908418034127,Podiatry,,,07340 603598,,"Scours Ln, Reading RG30 6AY, UK",,Google Places,8,"Berkshire Podiatry is a health clinic that requires clinical space for podiatry services, making it highly suitable for Unit 8.",clinic-target,5/5 (50 reviews),ChIJZQDAqn6bdkgRB0c63LwRH-g,Compton,unit8
Advanced footcare Group,https://advancedfootcaregroup.co.uk/,Health Clinic,,,01306 883332,,"Reigate Rd, Dorking RH4 1SD, UK",,Google Places,8,Suitable for clinical space and client-facing health practice,clinic-target,5/5 (8 reviews),ChIJw-9LQeLmdUgRQtpTFewNatE,Compton,unit8
Footmech Podiatry,http://www.footmech.co.uk/,Podiatry,,footmech@footmech.co.uk,07745 972664,,"The Cl, Reigate RH2 7BN, UK",,Google Places,9,Footmech Podiatry is a health clinic that requires a clinical space for client consultations.,clinic-target,5/5 (70 reviews),ChIJqfz8jcXkdUgRsBwlPQGa098,Compton,unit8
Podiatry Services Chiropodist Podiatrist Andrew Jenkins,http://andrewjenkinspodiatry.co.uk/,Podiatry,,,01903 741660,,"Thakeham Road, Storrington RH20 3NW, UK",,Google Places,9,Podiatry services require a clinical space for client consultations and treatments.,clinic-target,4.9/5 (7 reviews),ChIJTdViUB-8dUgRk4SLVCtfrJQ,Compton,unit8
Feet for Life Ltd,http://www.feet4lifeuk.com/,Health Clinic,,,020 7631 0724,,"18 Wimpole St, London W1G 8GD, UK",,Google Places,9,Health clinic suitable for client-facing services,clinic-target,4.8/5 (101 reviews),ChIJ9x41mNMadkgRTDsc7smbWeI,Compton,unit8
Saddler Sarah,https://www.theodihamclinic.co.uk/better-footcare/,Health Clinic,,,01256 702140,,"Odiham, Hook RG29 1LG, UK",,Google Places,9,Health clinic suitable for client-facing health practices,clinic-target,5/5 (1 reviews),ChIJo5kR0lUvdEgRtkee5n01xLQ,Compton,unit8
Counselling Directory,https://www.counselling-directory.org.uk/,Mental Health Services,,,0333 325 2500,,"Watchmoor Park, Camberley GU15 3YL, UK",,Google Places,9,"Counselling Directory supports mental health professionals, making it suitable for client-facing practices.",wellness,4.9/5 (130 reviews),ChIJYc7vpLcqdEgRCj_EhOmDC74,Compton,unit8
Reading Community Mental Health Team,https://www.berkshirehealthcare.nhs.uk/our-services/mental-health-and-wellbeing/berkshire-mental-health-service/,Mental Health Services,,,0118 960 5612,https://uk.linkedin.com/company/berkshire-healthcare-nhs-foundation-trust,"Honey End Ln, Reading RG30 4EL, UK",,Google Places,1,"NHS public sector clinic, not suitable for private practice space",clinic-target,1.5/5 (11 reviews),ChIJ-_iV5L-bdkgRQ7nnch8K2vg,Compton,unit8
Thornford Park | Elysium Healthcare,http://www.elysiumhealthcare.co.uk/locations/thornford-park/,healthcare,,,01635 860072,,"Crookham Hill, Thatcham RG19 8ET, UK",,Google Places,4,Large healthcare facility likely to outgrow the space,clinic-target,2.9/5 (14 reviews),ChIJ2cs-49umdkgRl-dr5-VeyUE,Compton,unit8
Oakleaf Enterprise,http://www.oakleaf-enterprise.org/,Health & Wellness,,client-services@oakleaf-enterprise.org,01483 303649,https://www.linkedin.com/company/oakleaf/?originalSubdomain=uk,"101 Walnut Tree Cl, Guildford GU1 4UQ, UK",,Google Places,6,Wellness focus but may be larger than suitable for Unit 8,wellness,4.6/5 (13 reviews),ChIJQZNVj5XQdUgRI1l8JKvMSuc,Compton,unit8
Community Mental Health Team for Older People (CMHT OP) - North East Hampshire,,Mental Health Services,,,01252 335544,,"Hospital Hill, Aldershot GU11 1AY, UK",,Google Places,2,Large public sector clinic not suitable for small professional space,clinic-target,3/5 (4 reviews),ChIJ_3XTprwsdEgREZPda9SUdIA,Compton,unit8
