company_name,website,sector,contact_name,email,phone,linkedin,location,employee_count,source,ai_score,ai_reason,tag,google_rating
lyndsymillsosteopathy,,Osteopathy,,,,,"54 Quarry St, Guildford GU1 3UA, UK",,Google Places,9,"Osteopathy requires a clinical space, making it highly suitable for client-facing health practices.",clinic-target,,ChIJHY9y18LRdUgRxNTslzocJik,Guildford
Osteopathy,,Osteopathy,,,,,"Woking Rd, Jacobs Well",,Google Places,9,"Osteopathy requires a clinical space for patient treatment, making it highly suitable.",clinic-target,5/5 (1 reviews),ChIJfQTaX07XdUgRbdz9CBOHGHw,Guildford
The HB Clinic - Horse Osteopath and PEMF Therapy,https://www.thehbclinic.co.uk/?utm_source=google&utm_medium=wix_google_business_profile&utm_campaign=6568261136104018162,Osteopathy,,,07876 104996,,"Worplesdon, Guildford GU3 3RQ, UK",,Google Places,1,"Focuses on equine therapy, not suitable for client-facing health practices in a small space.",wellness,5/5 (9 reviews),ChIJWwT2QvnXdUgR-Vw0-7gGdDw,Guildford
Alexandria Clinic,http://www.alpha-clinic.co.uk/,Chiropractic,,,01483 827039,,"15 Sheeplands Ave, Guildford GU1 2SG, UK",,Google Places,9,Chiropractic requires a clinical space for client consultations and treatments.,clinic-target,5/5 (2 reviews),ChIJUZIrZzzadUgRxH-F4z_Vt4Y,Guildford
Matthew Hewitson Chiropractor,https://mhewitsonchiropractor.co.uk/,Chiropractic,,,07442 714526,,"The Parade, Guildford GU2 9PB, UK",,Google Places,9,Chiropractic practice requires a clinical space for client consultations and treatments.,clinic-target,5/5 (105 reviews),ChIJwSbjAPDhVysRdlBPiTeNTiU,Guildford
The Guildford Chiropractor,https://theguildfordchiropractor.com/,Chiropractic,,,07775 294369,,"4 Burden Wy., Guildford GU2 9PB, UK",,Google Places,9,Chiropractic practice requires a clinical space for client consultations and treatments.,clinic-target,,ChIJ93AFbmzXdUgRTHHUOxZ94Pg,Guildford
Dr Paul Weston Chiropractor,,Chiropractic,,,07884 286773,,"Burden Wy., Guildford GU2 9PB, UK",,Google Places,9,Chiropractic requires a clinical space for client consultations and treatments.,clinic-target,5/5 (4 reviews),ChIJW5rGlL3QdUgR9f8HEtoaDto,Guildford
I Feel Good Therapy Clinic,http://www.ifeelgoodtherapy.com/,Therapy Clinic,,,07731 673759,,"Percy Rd, Guildford GU2 9PA, UK",,Google Places,9,Suitable for client-facing health/wellness practices,wellness,4.9/5 (64 reviews),ChIJaQCekcjQdUgRIL33W6-1Ieo,Guildford
www.PrivateGpCare.com,http://www.privategpcare.com/,Private GPs or small health clinics,,,07404 012793,,"Chertsey St, Guildford GU1 4HL, UK",,Google Places,9,Private health clinic suitable for client-facing health services,clinic-target,5/5 (22 reviews),ChIJ6fi1L-vRdUgRmTN7SFUBx-E,Guildford
"Levitas Clinic Guildford, Surrey",https://www.levitasclinic.com/?utm_source=local&utm_medium=organic&utm_content=gmb,Health Clinic,,,01483 452555,https://www.linkedin.com/company/levitas-clinic,"116 London Rd, Guildford GU1 1TN, UK",,Google Places,9,Health clinic suitable for client-facing practices,clinic-target,4.9/5 (331 reviews),ChIJO8cG2QvadUgRaze78hlBhdg,Guildford
Mount Alvernia Hospital,https://www.circlehealthgroup.co.uk/hospitals/mount-alvernia-hospital?utm_source=google&utm_medium=googlelocal&utm_campaign=bmimountalvernia,Hospital,,,01483 570122,https://www.linkedin.com/company/circlehealthgroup,"Harvey Rd, Guildford GU1 3LX, UK",,Google Places,1,Large hospital facility not suitable for small professional space,clinic-target,4.8/5 (857 reviews),ChIJ_-XDm57QdUgRkNerNBCvxxE,Guildford
Nuffield Health Guildford Hospital,https://www.nuffieldhealth.com/hospitals/guildford?utm_source=google&utm_medium=local&utm_campaign=GoogleLocal-Guildford-Hospital,healthcare,,,01483 555800,,"Stirling Rd, Guildford GU2 7RF, UK",,Google Places,1,Large hospital facility not suited for small professional space,clinic-target,4.6/5 (231 reviews),ChIJ263J6yHRdUgRyu1AIPGRE8w,Guildford
The Guildford Private General Practice,http://thegpgp.co.uk/,Private GPs or small health clinics,,,01483 826367,,"46 Harvey Rd, Guildford GU1 3LX, UK",,Google Places,9,Private health clinic requiring a professional space for client consultations,clinic-target,5/5 (3 reviews),ChIJyT-Qnp7QdUgR_e3wuA7OQRA,Guildford
Bupa Health Centre Guildford,https://www.bupa.co.uk/health/health-assessments/our-centres/guildford,Physiotherapy,,,01483 455327,,"Chertsey St, Guildford GU1 4HD, UK",,Google Places,8,Physiotherapy requires a clinical space suitable for client consultations and treatments.,clinic-target,4.3/5 (12 reviews),ChIJr_ZtrZ_QdUgRraHC3HnO9BA,Guildford
Spire Guildford Clinic,https://www.londondoctorsclinic.co.uk/clinics/spire-guildford-clinic/,Health Clinic,,,020 3733 5411,,"54 Quarry St, Guildford GU1 3UA, UK",,Google Places,1,Large health clinic likely to outgrow the space,clinic-target,,ChIJOQ3j-N_RdUgRii6VjkScvi4,Guildford
The Surrey Park Clinic,https://www.thesurreyparkclinic.co.uk/,Health Clinic,,,01483 945959,,"Stirling Rd, Guildford GU2 7RF, UK",,Google Places,9,"The Surrey Park Clinic is a health clinic, which aligns well with the clinical space needed for client-facing health practices.",clinic-target,4.6/5 (165 reviews),ChIJ3xrzom4FdkgRh2Zr9FFHTZE,Guildford
SurreyGP,http://www.surreygp.com/,Private GP,,,0345 459 9972,,"32-34 London Rd, Guildford GU1 2AB, UK",,Google Places,9,Private GP practice suitable for client-facing health services,clinic-target,4.1/5 (20 reviews),ChIJuWlzGp_QdUgRhUS12pB_tg8,Guildford
Thérapie Clinic - Guildford,https://therapieclinic.com/locations/guildford?utm_source=google&utm_medium=organic&utm_campaign=gmb&utm_content=guildford,Health & Wellness,,,01483 940088,,"228 High St, Guildford GU1 3JD, UK",,Google Places,8,Suitable for client-facing health/wellness practices,wellness,4.8/5 (649 reviews),ChIJU0ha5cXRdUgRWxCsJSuZ-Kc,Guildford
Medi-Clinic,,Health & Wellness,,,,,"1 Pewley Way, Guildford GU1 3PX, UK",,Google Places,8,Suitable for client-facing health/wellness practices,wellness,,ChIJMyzEr9fRdUgRxdT1v9H1BDg,Guildford
Surrey Cardiovascular Clinic,https://www.scvc.co.uk/,Health Clinic,,,01483 467100,,"5 Huxley Rd, Guildford GU2 7RE, UK",,Google Places,9,Suitable as a health clinic needing a professional space for client-facing services.,clinic-target,4.5/5 (8 reviews),ChIJE-je4CHRdUgROdq6z6UNENo,Guildford
Private GP Clinic - Guildford,http://www.privategpclinic.co.uk/,Private GP or small health clinic,,,01932 344004,,"Send, Guildford GU23 7HU, UK",,Google Places,9,Requires clinical space for patient consultations,clinic-target,,ChIJc0om_mnZdUgR0Owx7lc_55o,Guildford
Austen Road Surgery,https://www.austenroadsurgery.nhs.uk/,Health Clinic,,,01483 564578,,"1 Austen Rd, Guildford GU1 3NW, UK",,Google Places,2,"NHS clinic, not suitable for small professional space",clinic-target,3.6/5 (49 reviews),ChIJMUuyrnXadUgRBIuUJvDP-MY,Guildford
Dapdune House Surgery,https://dapdune.nhs.uk/,Health Clinic,,,01483 400200,,"Wharf Rd, Guildford GU1 4RP, UK",,Google Places,1,NHS public sector clinic not suitable for private professional space,clinic-target,3.1/5 (108 reviews),ChIJ1QVg6b3QdUgR23mx8PSEGJI,Guildford
The Guildford Clinic,,Health & Wellness,,,01483 207300,,"The Guildford Clinic, 170 Priestley Rd",,Google Places,9,Suitable for client-facing health and wellness practices,wellness,,ChIJE9srNiLRdUgRvAAJdaYxuf4,Guildford
My Healthcare Clinic,,Health Clinic,,,,,"Jeffries Passage, Guildford GU1 4AB, UK",,Google Places,8,Suitable for client-facing health practices in a professional space,clinic-target,,ChIJpcfJzRzRdUgR0gVGcX5Zu-4,Guildford
The Student Health Centre,https://www.guildowns.nhs.uk/our-surgeries/the-student-health-centre/,NHS clinic,,,01483 409309,,"Stag Hill, Guildford GU2 7JN, UK",,Google Places,1,"NHS public sector clinic, not suitable for private practice space",clinic-target,2.2/5 (10 reviews),ChIJuU0WIcLQdUgRjB-wtvVNfao,Guildford
Laser Clinics UK - Guildford,https://www.laserclinics.co.uk/skin-care-clinics/guildford/?utm_source=google&utm_medium=organic&utm_campaign=Google%20My%20Business%20Page&utm_content=Guildford&utm_term=plcid_17242721197944776115,wellness,,,01483 802455,,"121 High St, Guildford GU1 3DP, UK",,Google Places,6,Wellness-focused but may require more space for equipment and treatments,wellness,4.2/5 (101 reviews),ChIJrwaCYpfRdUgRreXZoT_63uY,Guildford
Guildowns University Medical Centre,http://guildowns.nhs.uk/,Health & Wellness,,,01483 409309,,"University of Surrey, Stag Hill",,Google Places,1,"NHS or public sector clinic, not suitable for a small professional space",clinic-target,2.1/5 (16 reviews),ChIJXfds97_QdUgRlzCV8Khtqm0,Guildford
Sync Dental Guildford,https://syncdental.co.uk/locations/guildford/,Dental,,,01483 504371,,"26 London Rd, Guildford GU1 2AF, UK",,Google Places,4,Dental practice requires more specialized facilities and space than Unit 8 offers.,clinic-target,4.8/5 (276 reviews),ChIJp9CFH5_QdUgR1u5WRpGOcc4,Guildford
Guildford Dental Partnership,http://www.gdpguildford.co.uk/,Dental Practice,,,01483 440563,,"44 London Rd, Guildford GU1 2AF, UK",,Google Places,9,Private dental practice suitable for client-facing health services,clinic-target,4.9/5 (109 reviews),ChIJhRxUDJ_QdUgRfTX3JG97FyI,Guildford
Guildford Dental Centre,http://www.guildforddentalcentre.co.uk/,Dental Clinic,,,01483 535220,,"26 Farnham Rd, Guildford GU2 4JN",,Google Places,6,Suitable for dental practice but may require more space for equipment and patient flow.,clinic-target,4.8/5 (113 reviews),ChIJp4dnfpPQdUgRJabqFBsqMd8,Guildford
London Road Dental Practice,http://londonroaddentalpractice.com/,Dental,,info@londonroaddentalpractice.comFor,01483 300022,,"42A London Rd, Guildford GU1 2AF, UK",,Google Places,9,Private dental practice requiring a professional clinical space.,clinic-target,4.4/5 (67 reviews),ChIJp9CFH5_QdUgRVZubo-GPqwo,Guildford
Guildford Smiles Dental Practice,https://www.guildfordsmilesdental.co.uk/,Dental,,,01483 361739,,"8 Phoenix Ct, Guildford GU1 3EG, UK",,Google Places,8,Cosmetic dental practice suitable for client-facing health services,clinic-target,4.3/5 (67 reviews),ChIJXZyKY1zRdUgRJ7UriRiYqG8,Guildford
Woodbridge Hill Dental Practice Guildford,https://www.woodbridgedental.co.uk/,Dental,,,01483 568584,,"49A Woodbridge Hill, Guildford GU2 9ZD, UK",,Google Places,4,"Dental practices require larger, purpose-built spaces for equipment and patient flow.",clinic-target,4.9/5 (549 reviews),ChIJ26TaqMfQdUgRZmaSakvTu88,Guildford
Bupa Dental Care Guildford,https://www.bupa.co.uk/dental/dental-care/practices/guildford?y_source=1_MTE2Njk5OTYtNzE1LWxvY2F0aW9uLndlYnNpdGU%3D,Dental,,,01483 573282,,"17 London Rd, Guildford GU1 2AA, UK",,Google Places,4,Large dental practice likely requires more space and resources than Unit 8 offers.,clinic-target,4.6/5 (81 reviews),ChIJ_zvfbJ_QdUgRgGNx_gK6_3I,Guildford
Rectory House Dental Practice,https://www.rectoryhousedental.co.uk/,Dental,,,01483 575620,,"40 Epsom Rd, Guildford GU1 3LF, UK",,Google Places,8,Suitable for a private dental practice needing a professional space.,clinic-target,5/5 (89 reviews),ChIJ6eklZznadUgRKHAnisgNy-A,Guildford
Burneston Dental - Dentists in Guildford,http://www.burnestondental.com/,Cosmetic dentists or private dental practices,,,01483 573630,,"44 Epsom Rd, Guildford GU1 3LF, UK",,Google Places,8,Suitable for client-facing dental practice with professional space needs,clinic-target,4.7/5 (33 reviews),ChIJYc7cZ5_QdUgR_eKGsGb0CgY,Guildford
Surrey Dental Practice,https://www.surreydentalpractice.co.uk/,Dental Practice,,,01483 506277,,"127 Worplesdon Rd, Guildford GU2 9XA, UK",,Google Places,8,Suitable for client-facing health practices with a need for professional space.,clinic-target,4.8/5 (126 reviews),ChIJubEycc7QdUgRNkdoLB3y0-o,Guildford
17 Dental,http://17dental.com/,Dental,Dr Waseem Akhtar,info@17dental.com,01483 575908,,"17 Aldershot Rd, Guildford GU2 8AE, UK",,Google Places,8,Private dental practice suitable for client-facing health services,clinic-target,4.7/5 (121 reviews),ChIJB4ty38XQdUgRSmIUHVkKGg8,Guildford
Northdene Dental Surgery,http://www.northdenedentalsurgery.co.uk/,Dental Practice,,,01483 560068,,"13 London Rd, Guildford GU1 2AA, UK",,Google Places,8,Private dental practice suitable for client-facing health services,clinic-target,4.1/5 (32 reviews),ChIJG2d3E5_QdUgRZyrfoViGMbA,Guildford
Dene Lodge Dental Practice,http://denelodgedental.com/,Dental Practice,,,01483 575865,,"9 London Rd, Guildford GU1 2AA, UK",,Google Places,8,Private dental practice suitable for client-facing health services,clinic-target,4.7/5 (77 reviews),ChIJEeFOFJ_QdUgRP-TG40RnJu8,Guildford
Fairlands Dental & Implant Centre,http://www.fairlandsdental.co.uk/,Dental,,,01483 233823,,"Fairlands, Guildford GU3 3NA, UK",,Google Places,4,"Dental practice requires larger, purpose-built premises for equipment and patient flow.",clinic-target,4.7/5 (364 reviews),ChIJJzkyXs3WdUgRoqWc4DngXak,Guildford
Farnham Road Dental Practice,https://www.theguildforddentist.com/,Dental Practice,,,01483 562641,,"30 Farnham Rd, Guildford GU2 4JN",,Google Places,4,"Dental practices typically require larger, purpose-built facilities.",clinic-target,4.5/5 (8 reviews),ChIJefdUfJPQdUgRov7jrb82br4,Guildford
Guildford Foot Clinic,,Health Clinic,,,01483 532452,,"42 London Rd, Guildford GU1 2AF, UK",,Google Places,9,Health clinic suitable for client-facing services in a professional space.,clinic-target,4.5/5 (43 reviews),ChIJcUtpDZ_QdUgRCMPINmnAPpM,Guildford
Margaret Dabbs London,https://www.margaretdabbs.co.uk/margaret-dabbs-guildford/,health clinic,,,01483 440367,,"23-25 Chapel St, Guildford GU1 3UL, UK",,Google Places,9,Health clinic suitable for client-facing services,clinic-target,4.7/5 (173 reviews),ChIJfZvdsJDQdUgRj0uDR22uv1c,Guildford
Max Patel,http://www.completefootcareclinic.co.uk/,Health Clinic,,,01483 564109,,"6 Onslow Rd, Guildford GU1 4HU, UK",,Google Places,8,Health clinic suitable for client-facing health practices,clinic-target,4.8/5 (21 reviews),ChIJp1Bep3XadUgR6uOyTwQJsDc,Guildford
Quest Podiatry - Foot and Ankle Clinic,https://questpodiatry.co.uk/,Podiatry,,hello@questpodiatry.co.uk,01483 569550,https://www.linkedin.com/company/questpodiatry/,"Onslow Village, Guildford GU2 7QR, UK",,Google Places,9,Requires clinical space for client consultations and treatments,clinic-target,5/5 (47 reviews),ChIJa97LQOTQdUgRzxcVQEyxsXg,Guildford
Walking On Air Well Being,http://www.walkingonair-guildford.co.uk/,Health Clinic,,info@walkingonair-guildford.co.uk,01483 454000,,"73 Broad St, Guildford GU3 3BG, UK",3,Google Places,9,"Health clinic fits well in a small, professional space for client-facing services.",clinic-target,5/5 (50 reviews),ChIJdbuNFyjRdUgRkv_sUqoc-Ak,Guildford
The Foot & Ankle Clinic,https://footandankleclinic.co.uk/,Health Clinic,,,01483 577456,,"46 Harvey Rd, Guildford GU1 3LX, UK",,Google Places,9,"Specialized health clinic focused on foot and ankle care, suitable for clinical space.",clinic-target,,ChIJnQswnJ7QdUgRB9A48-ZCvFI,Guildford
Jarvis Breast Screening Centre,https://www.breast-screening.surrey.nhs.uk/userhome.aspx,health clinic,,inl.jarvisadmin@nhs.net,0333 200 2062,,"Stoughton Rd, Guildford GU1 1LH, UK",,Google Places,2,"NHS clinic, not suitable for a small professional space",clinic-target,4.6/5 (30 reviews),ChIJPSA2lLDQdUgR0tDDoxH1P9Y,Guildford
FootFingers Podiatry,https://www.footfingerspodiatry.co.uk/,Podiatry,,enquiries@footfingerspodiatry.co.uk,07950 486308,,"Send, Woking GU23 7ET, UK",,Google Places,9,Requires clinical space for podiatry services,clinic-target,5/5 (31 reviews),ChIJEzwuuOTZdUgRbBZibQIPuPs,Guildford
EA Smith Chiropodist,,Chiropody,,,01483 477180,,"1 Stirling Rd, Guildford GU2 7RF, UK",,Google Places,9,Requires clinical space for client consultations,clinic-target,,ChIJ263J6yHRdUgRJOS9LpR3Pek,Guildford
Dr Ben Mead - Clinical Psychologist,http://www.drbenjmead.co.uk/,Psychotherapy,,ben@drbenjmead.co.uk,07587 191396,,"85 Epsom Rd, Guildford GU1 3PA, UK",,Google Places,9,"Clinical psychologist requiring a professional, quiet space for client sessions.",wellness,4.7/5 (13 reviews),ChIJef5sp3XadUgRKX-xteGF0Ww,Guildford
Adrian Stearman Counselling & Psychotherapy,https://adrianstearmancounselling.co.uk/,Psychotherapy,,adrianstearman@hotmail.com,07966 199536,,"Mill Ln, Guildford GU1 3TZ, UK",,Google Places,9,"Counselling and psychotherapy require a quiet, professional space for client sessions.",wellness,5/5 (6 reviews),ChIJtZvK5r3RdUgRqLDWzs1wVM4,Guildford
Ben Lee Counselling,https://www.benleecounselling.com/,Mental Health,,,07739 142754,,"Mill Ln, Guildford GU1 3TZ, UK",,Google Places,9,Counselling is a client-facing health practice suitable for a quiet professional space.,wellness,5/5 (5 reviews),ChIJ13Nnfg3RdUgRAuXX7BQO9q8,Guildford
Emma Pott Counselling and Psychotherapy,http://www.emmapott.com/,Counselling and Psychotherapy,,info@emmapott.com,01483 917000,,"Railton Rd, Guildford GU2 9JX, UK",,Google Places,9,Ideal for client-facing mental health services in a quiet professional space.,wellness,5/5 (2 reviews),ChIJxdQbe9PRdUgR0pxtjMfEKkA,Guildford
Kirstin Maddalena Counsellor,https://www.psychotherapistguildford.co.uk/,Mental Health,,,07909 147008,,"Quarry Gate, Shalford Rd, Guildford GU1 3XL",,Google Places,9,Counsellor suitable for client-facing health practices,wellness,5/5 (3 reviews),ChIJLwbnANnRdUgRGg5ZKotvnqg,Guildford
The Mindful Clinic,http://www.themindfulclinic.co.uk/,Mental health professionals,,,07724 106494,,"6 Quarry St, Guildford GU1 3UR, UK",,Google Places,9,"The Mindful Clinic focuses on health and wellness, making it suitable for a client-facing practice in a professional space.",wellness,5/5 (5 reviews),ChIJPei-mozRdUgRdZdetTxeZis,Guildford
Guildford Counsellor and Cognitive Behavioural Therapist,https://guildfordcounsellor.co.uk/,Psychotherapy,,a-time-to-heal@hotmail.com,07437 449575,,"Selbourne Rd, Guildford GU4 7JP, UK",,Google Places,9,Ideal for client-facing therapy sessions in a quiet space,wellness,5/5 (1 reviews),ChIJAcXnRATadUgR7VHi5OTnNPM,Guildford
Sophie Grant ~ Counselling & Psychotherapy,https://therapygrant.wordpress.com/,Mental health professionals,,,,,"Ludlow Rd, Guildford GU2 7NR, UK",,Google Places,9,"Counselling and psychotherapy require a quiet, professional space for client sessions.",wellness,5/5 (2 reviews),ChIJu1k15VnVdUgRR0eA9n_i564,Guildford
Refresh Counselling and Psychotherapy,https://www.refresh-counselling.co.uk/,Psychotherapy,,louise@refresh-counselling.co.uk,07973 287424,,"Railton Rd, Guildford GU2 9JX, UK",,Google Places,9,Ideal for client-facing therapy sessions in a quiet space,wellness,5/5 (1 reviews),ChIJO2NZp-3RdUgRHh1Fm8I5mOA,Guildford
Kim Barden Therapies,https://kimbarden.com/,Health & Wellness,,,07771 631614,,"10 Pimms Cl, Guildford GU4 7YG, UK",,Google Places,9,Health and wellness therapies align well with client-facing practices suitable for the space.,wellness,5/5 (24 reviews),ChIJleqqelHbdUgRGalBcxQlsi8,Guildford
Wellshare Consulting Rooms,http://www.wellshare.co.uk/,Physiotherapy,,contact@wellshare.co.uk,01483 550156,https://www.linkedin.com/in/wellshare-consulting-rooms-581384352/,"54 Quarry St, Guildford GU1 3UA, UK",,Google Places,9,"Physiotherapy requires clinical space, making it highly suitable for Unit 8.",clinic-target,5/5 (13 reviews),ChIJ_TSwCWTRdUgRRvCke-zQfV4,Guildford
Charlie Fancy Therapy,http://www.charliefancy.co.uk/,Therapy,,,07447 677169,,"Railton Rd, Guildford GU2 9JX, UK",,Google Places,9,Suitable for client-facing health/wellness practices,wellness,5/5 (8 reviews),ChIJu7-faK_RdUgRJNZrVGAytEc,Guildford
thinkWell Practice - Guildford Hypnotherapy,https://www.thinkwellpractice.com/,Hypnotherapy,,help@thinkwellpractice.com,07764 584000,,"Ward St, Guildford GU1 4LH, UK",,Google Places,8,Hypnotherapy is a client-facing health practice that fits well in a professional space.,wellness,5/5 (6 reviews),ChIJRS88ZF_8yKgR4DbF9c3mN-w,Guildford
Co-Parenting Matters,https://www.brighterspacesuk.com/locations/guildford/,Health & Wellness,,,01483 351331,,"54 Quarry St, Guildford GU1 3UA, UK",,Google Places,5,Potentially suitable for client-facing sessions but may not fully utilize the space.,wellness,5/5 (2 reviews),ChIJiWJIsVbRdUgRcLdzVt1tIxY,Guildford
"Dr Michael Munday, Clinical Psychologist Guildford, Adults & Adolescents Therapy",https://www.drmichaelmunday.co.uk/,Psychotherapy,,,07989 335885,,"13 Quarry St, Guildford GU1 3UY, UK",,Google Places,9,"Clinical psychologist requiring a quiet, professional space for therapy sessions.",wellness,,ChIJwQn4s03RdUgRRkSONuWZ4ZQ,Guildford
Safe Haven Guildford,,Health & Wellness,,,01483 303649,,"101 Walnut Tree Cl, Guildford GU1 4UQ, UK",,Google Places,6,Wellness-focused but may be larger than the space can accommodate,wellness,3.8/5 (16 reviews),ChIJF7ifjJXQdUgRP0UgldZRkcU,Guildford
Canterbury Care Centre,http://canterburycarecentre.com/,Health & Wellness,,,07927 913290,,"23 Waterden Rd, Guildford GU1 2AZ, UK",,Google Places,8,Suitable for client-facing health/wellness practices,wellness,5/5 (1 reviews),ChIJbc7NxZ_QdUgR3fpUFv1a2lI,Guildford
Guildford Therapy Rooms,http://www.guildfordtherapyrooms.com/,Therapy Rooms,,office@guildfordtherapyrooms.co.uk,07795 023522,,"Beaufort Parklands, Guildford GU2 9JX, UK",,Google Places,9,Suitable for client-facing health and wellness practices in a professional space.,wellness,,ChIJGWmXD9jRdUgRDop8n0S4kKk,Guildford
Azalea House,https://www.mindworks-surrey.org/,Health & Wellness,,,01372 216111,,"Azalea House, Farnham Road Hospital, Guildford GU2 7LX",,Google Places,5,Business is health-focused but may be larger than suitable for Unit 8,wellness,5/5 (1 reviews),ChIJwbcgQjjRdUgRudNmnbE2HqM,Guildford
Centre for Wellbeing,https://my.surrey.ac.uk/wellbeing/centre-for-wellbeing,Health & Wellness,,centreforwellbeing@surrey.ac.uk,01483 689498,,"University Campus, Guildford GU2 7TE, UK",,Google Places,7,Wellness focus but may be larger than suitable for Unit 8,wellness,3.5/5 (4 reviews),ChIJES4W9b_QdUgRmPPaKc_NlQo,Guildford
Victoria Ward,https://www.sabp.nhs.uk/our-services/mental-health/inpatient-services-1/FRHvicWard,mental health,,,01483 443568,http://www.linkedin.com/company/nhs-surrey-and-borders-partnership,"Hospital, Farnham Rd, Guildford GU2 7LX",,Google Places,2,"NHS public sector clinic, not suitable for private space",clinic-target,4/5 (1 reviews),ChIJC58zSPfRdUgRkVa8ufnHOk8,Guildford
Dr Siobhan Blackwell clinical psychologist,https://surreypsychologist.com/,Mental Health,,,07795 530275,,"54 Quarry St, Guildford GU1 3UA, UK",,Google Places,9,"Clinical psychologist requiring a quiet, professional space for client consultations",wellness,5/5 (1 reviews),ChIJV3AnNGjRdUgRMBgniTh2dOk,Guildford
Hope Day Service,https://www.hopeservice.org.uk/,Health & Wellness,,,01483 517190,,"57-59 Worplesdon Rd, Guildford GU2 9RS, UK",,Google Places,5,Potentially suitable for wellness services but may be larger than the space allows.,wellness,3.6/5 (9 reviews),ChIJH6G2cXPadUgRoXdbzpF6HPE,Guildford
Rooted Risings,https://rootedrisings.com/,wellness coaching,,,07752 322150,,"54 Quarry St, Guildford GU1 3UA, UK",,Google Places,6,Wellness-focused business that may benefit from a professional space but could be larger than Unit 8,wellness,5/5 (1 reviews),ChIJJb21VMy2X6IRSSFo2NfwkH4,Guildford
Skills for Life Coaching,https://www.skillsforlifecoaching.co.uk/,Wellness Coaching,,,07977 497209,,"Pewley Way, Guildford GU1 3PY, UK",,Google Places,6,Wellness coaching fits well but may not fully utilize clinical space.,wellness,5/5 (17 reviews),ChIJZ9fmxUPRdUgRHHF2Y-ouWzY,Guildford
Counselling Guildford,,Counselling,,,07751 316953,,"36 Hodgson Gardens, Guildford GU4 7YS, UK",,Google Places,9,Ideal for client-facing therapeutic practices,wellness,5/5 (1 reviews),ChIJc3M5CwTadUgR49foxlsXJds,Guildford
Hilary Barratt Counselling,,Mental Health,,,01483 571986,,"53 Ridgemount, Guildford GU2 7TH, UK",,Google Places,9,Counselling services require a professional and quiet space for client sessions.,wellness,5/5 (3 reviews),ChIJWU0eYOrQdUgRN7JLhYs0DjM,Guildford
Revive Sex and Relationship Therapy,https://www.revivesexandrelationships.co.uk/,Psychotherapy,Bridget Wilkins,bridget.wilkins@revivesexandrelationships.co.uk,,,"54 Quarry St, Guildford GU1 3UA, UK",,Google Places,9,Therapy practice suitable for client-facing health services,wellness,5/5 (1 reviews),ChIJ2bhtKBbRdUgREUPHovhhZrg,Guildford
Guildford Pilates Place,http://www.guildfordpilatesplace.co.uk/,Pilates Studio,,pilates@guildfordpilatesplace.co.uk,01483 506113,,"38-42 High St, Guildford GU1 3EL, UK",,Google Places,7,Suitable for small group classes but may outgrow the space,wellness,5/5 (13 reviews),ChIJs5lyupDQdUgRebqEdN1ZZ8Y,Guildford
Love Pilates Guildford,http://lovepilatesguildford.com/,Pilates Studio,,,07555 496396,,"Trinity Churchyard, Guildford GU1 3HN, UK",,Google Places,7,Small pilates studio suitable for client-facing wellness practices,wellness,5/5 (3 reviews),ChIJBTGx1SXRdUgRtA--ZoqLTBE,Guildford
Studio W,https://www.thestudiow.co.uk/,Yoga Studio,,,,,"Railton Rd, Guildford GU2 9JX, UK",,Google Places,8,Suitable for client-facing wellness practices with potential for group classes,wellness,5/5 (5 reviews),ChIJ9x38bVzRdUgRnB0XmP0CUdI,Guildford
Sissy Grapsa Pilates classes,https://sissygrapsapilates.com/,Pilates Studio,,,07545 453476,,"Warren Rd, Guildford GU1 3JH, UK",,Google Places,7,"Small pilates classes fit well in a professional space, but may need to consider space limitations for group sizes.",wellness,5/5 (8 reviews),ChIJmT2QgzPbdUgR3BjY-h-6sC0,Guildford
Surrey Ballroom and Pilates,http://www.surreyballroomandpilates.com/,Pilates and fitness,,,07971 262428,,"5 Trinity Churchyard, Guildford GU1 3RR, UK",,Google Places,6,Currently offers pilates classes but may outgrow the space,wellness,5/5 (1 reviews),ChIJ-dUq_5nQdUgRa2NCRAZUfFI,Guildford
