company_name,website,sector,contact_name,email,phone,linkedin,location,employee_count,source,ai_score,ai_reason,tag,google_rating
Surrey Total Health,http://www.surreytotalhealth.co.uk/,Health & Wellness,,info@surreytotalhealth.co.uk,07983 322574,,"Shores Rd, Woking GU21 4BY, UK",,Google Places,7,Wellness-focused business that may benefit from a professional space but could potentially outgrow it.,wellness,1/5 (1 reviews),ChIJbc_rCBvYdUgRbCXKRG0E2Uc,Woking
Southview Surgery,http://www.southviewmedicalpractice.nhs.uk/,Health Clinic,,,01483 766099,,"Guildford Rd, Woking GU22 7RR",,Google Places,2,"NHS clinic, not suitable for small professional space",clinic-target,2.2/5 (87 reviews),ChIJR98bcCjYdUgRr4HVIuQRO18,Woking
The Family Practice,http://www.thefamilypractice-stjohns.co.uk/,Health & Wellness,,,01483 227060,,"St. Johns Health Centre/Hermitage Rd, Woking GU21 8TD, UK",,Google Places,6,Medium suitability as they may be larger and could outgrow the space,wellness,2.3/5 (39 reviews),ChIJTSgkhK_XdUgRMYG20Hv6iJs,Woking
Woking Dental Care,https://wokingdentalcare.co.uk/?utm_source=local&utm_medium=organic&utm_content=gmb,Dental,,admin@wokingdentalcare.co.uk,01483 763360,,"5A Oriental Rd, Woking GU22 7AH, UK",,Google Places,6,Dental practice fits well but may require more space for equipment and patient flow.,clinic-target,4.9/5 (404 reviews),ChIJoy_UFyTYdUgR4ZrfoKblq-8,Woking
Perfect Smile - Dentist in Woking,https://www.perfectsmile-dental.com/clinics/dentist-woking/?utm_source=gmb&utm_medium=map,Cosmetic dentistry,,,01483 728186,,"99 Goldsworth Rd, Woking GU21 6LJ, UK",,Google Places,8,Suitable for client-facing dental practice in a professional space,clinic-target,4.7/5 (412 reviews),ChIJ_6znB4nXdUgRUgzSKq-CwUs,Woking
Goldsworth Road Dental & Implant Centre,https://www.goldsworthroaddental.co.uk/,Cosmetic dentistry,,,01483 495303,,"96 Goldsworth Rd, Woking GU21 6LN, UK",,Google Places,8,Private dental practice suitable for client-facing health services,clinic-target,4.9/5 (159 reviews),ChIJ2XFPJonXdUgRE7Fp9yEqfHY,Woking
Bupa Dental Care Woking,https://www.bupa.co.uk/dental/dental-care/practices/woking?y_source=1_MTE2NzAyMjAtNzE1LWxvY2F0aW9uLndlYnNpdGU%3D,dental,,,01483 761777,,"The Retreat, Guildford Rd, Woking GU22 7QJ",,Google Places,4,Large dental practice likely to outgrow the space,clinic-target,4.7/5 (224 reviews),ChIJl7JfB3_XdUgRDNeDkz-3IZM,Woking
Damira Maycroft,https://damiradental.co.uk/location/maycroft/?utm_source=google&utm_medium=organic&utm_campaign=gbp-maycroft-dental-practice,Cosmetic dentistry,,,01483 773753,,"Chobham Rd, Woking GU21 4AB, UK",,Google Places,9,Private dental practice suitable for client-facing health services,clinic-target,4.4/5 (628 reviews),ChIJ-3UxriHYdUgR0Qdvdw-OHHI,Woking
Sync Dental Parkside,https://syncdental.co.uk/locations/parkside/,Dental,,,01483 766355,,"Goldsworth House, Woking GU21 3LQ, UK",,Google Places,8,Private dental practice suitable for client-facing health services,clinic-target,4.7/5 (617 reviews),ChIJubPlBLzXdUgR22zTtvg7f8M,Woking
The Dental Practice On Broadway,https://www.dentalpb.co.uk/?utm_source=gmb&utm_medium=organic,Dental Practice,,,01483 730808,,"6 The Broadway, Woking GU21 5AP, UK",,Google Places,9,Cosmetic dental practice fits well in a professional client-facing space.,clinic-target,4.9/5 (36 reviews),ChIJQ_BX9SPYdUgRofLZuDfQMAM,Woking
Lorna Doone Dental Surgery,http://www.lornadoonedental.co.uk/,Dental,,,01483 763107,,"Chobham Rd, Woking GU21 4AA, UK",,Google Places,8,Private dental practice suitable for client-facing health services,clinic-target,4.5/5 (34 reviews),ChIJR_8zoSHYdUgRuccNZaYYq04,Woking
Bradstowe Dental Practice,http://www.bradstowedental.co.uk/,Dental Practice,,info@bradstowedental.co.uk,01483 761784,,"Chobham Road, Woking GU21 4AL, UK",,Google Places,4,"Dental practices typically require larger, purpose-built facilities.",clinic-target,4.8/5 (21 reviews),ChIJR6nGSyDYdUgRjAszYbf_Swk,Woking
MacroCare Dental Health,,Cosmetic dentistry,,,01483 721740,,"5 High St, Woking GU21 6BG, UK",,Google Places,9,Private dental practice suitable for client-facing health services,clinic-target,3.4/5 (24 reviews),ChIJIaihZevXdUgReAOcuxCj3zM,Woking
Smile For Life Dental Clinics,,Cosmetic dentistry,,,01483 728186,,"99 Goldsworth Rd, Woking GU21 6LJ, UK",,Google Places,9,Private dental practice suitable for client-facing health services,clinic-target,2.9/5 (7 reviews),ChIJm6kYG4nXdUgR1v4vTImkKbk,Woking
Sync Dental Pyrford,https://syncdental.co.uk/locations/pyrford/,Dental,,,01932 352333,,"Pyrford, Woking GU22 8SW, UK",,Google Places,6,Private dental practice suitable for client-facing space but may require more specialized facilities.,clinic-target,4.8/5 (676 reviews),ChIJ4z_R21fZdUgRp7FRlMUzIc4,Woking
Woking E D S,,Dental,,,01483 721546,,"Heathside Rd, Woking GU22 7HS, UK",,Google Places,9,Suitable for a private dental practice with client-facing needs,clinic-target,5/5 (2 reviews),ChIJEdgadSbYdUgR0jZKtd80rXE,Woking
Bupa Dental Care Woking- Westfield Road,https://www.bupa.co.uk/dental/dental-care/practices/woking-westfield-road?y_source=1_MTE2NzAyMTctNzE1LWxvY2F0aW9uLndlYnNpdGU%3D,dental,,,01483 760804,,"1 Westfield Rd, Woking GU22 9LZ, UK",,Google Places,4,Large dental practice likely requires more space and facilities than Unit 8 offers.,clinic-target,4.8/5 (50 reviews),ChIJQ3gxXdPZdUgRnUCsH78M7wU,Woking
iQ Braces & Faces,http://iqbracesandfaces.co.uk/,Dental,,info@iqbracesandfaces.co.uk,01483 901082,,"The Peacocks Centre, Woking GU21 6GH, UK",,Google Places,6,Private dental practice suitable for a professional space but may require more room for equipment and patient flow.,clinic-target,4.6/5 (207 reviews),ChIJIypERb7ZdUgRil4NgBtc0ow,Woking
Bright Dental Surgery,http://www.bdsurgery.co.uk/,Dental,,,01483 720240,,"St John's, Woking GU21 8TE, UK",,Google Places,9,Private dental practice suitable for client-facing health services,clinic-target,4/5 (110 reviews),ChIJHwkTN9_XdUgRxDP9qrbiTFY,Woking
Bupa Dental Care Woking - Knaphill,https://www.bupa.co.uk/dental/dental-care/practices/woking-knaphill?y_source=1_MTE2NzAyMTUtNzE1LWxvY2F0aW9uLndlYnNpdGU%3D,Dental,,,01483 475822,,"Knaphill, Woking GU21 2QH, UK",,Google Places,9,Suitable for client-facing dental practice with a need for a professional space.,clinic-target,4.7/5 (268 reviews),ChIJw-gPlkXWdUgRfaLHdzHlRtY,Woking
Woking Private Dentist,https://www.privatedentistwoking.co.uk/,Cosmetic dentists or private dental practices,,,,,"Chobham Rd, Woking GU21 4AB, UK",,Google Places,9,Private dental practice suitable for client-facing health services,clinic-target,,ChIJseA3JgDZdUgRdczqcDQvLZQ,Woking
Surrey Dental & Aesthetics,http://www.sdaa.uk/,Cosmetic dentistry,Open Hours,contact@dentist.com,01932 352486,,"40A Station Approach, West Byfleet KT14 6NE, UK",,Google Places,9,Cosmetic dental practice fits well in a professional clinical space.,clinic-target,5/5 (267 reviews),ChIJpU7jlid2dkgR53UiCMmIMuw,Woking
Wilson Chiropody and Podiatry - Woking,https://www.wilsonpodiatry.co.uk/,Podiatry,,,07411 135848,,"1 Westfield Rd, Woking GU22 9LZ, UK",,Google Places,9,Requires clinical space for podiatry services,clinic-target,4.8/5 (24 reviews),ChIJL-IwXdPZdUgRUJBl-FOsRXM,Woking
St John's Foot Clinic,http://www.stjohnsfootclinic.co.uk/,Health Clinic,,,01483 715771,,"Hermitage Rd, Woking GU21 8TD, UK",,Google Places,9,Suitable as a health clinic providing client-facing services in a professional space.,clinic-target,5/5 (41 reviews),ChIJr9gkhK_XdUgR8YBmOrPZs9c,Woking
Knaphill Foot Clinic,http://knaphill-foot-clinic.co.uk/,Health & Wellness,,,01483 651231,,"Knaphill, Woking GU21 2PD, UK",,Google Places,8,"Specialized health clinic focusing on foot care, suitable for client-facing practice.",clinic-target,5/5 (3 reviews),ChIJV1Uppk7WdUgRdoJp_2RUVz4,Woking
The Podiatry & Laser Clinic,https://thepodiatryandlaserclinic.uk/,Podiatry,,,01932 336000,,"Madeira Rd, West Byfleet KT14 6DH, UK",,Google Places,9,Requires clinical space for podiatry services,clinic-target,5/5 (8 reviews),ChIJq6oaHYXYdUgRkWZ5Pi9avEE,Woking
Revive Footcare,http://www.revivefootcare.com/,Health Clinic,,,07528 513275,,"Byfleet, West Byfleet KT14 7LZ, UK",,Google Places,9,Health clinic suitable for client-facing services in a professional space.,clinic-target,5/5 (29 reviews),ChIJkeXCJGXYdUgRZmta3ZG90tI,Woking
Revive Footcare West Byfleet,http://www.parkview-podiatry.co.uk/,Podiatry,,,07790 142401,,"Pyrford Rd, West Byfleet KT14 6LD, UK",,Google Places,9,Health clinic suitable for client-facing services in a professional space.,clinic-target,5/5 (2 reviews),ChIJ1_qT323YdUgRGOCMqlV0rTo,Woking
Woodlands Clinic,https://www.woodlandsclinic.uk/,Health & Wellness,,,01932 880035,,"New Haw, Addlestone KT15 3EU, UK",,Google Places,9,Health and wellness clinic suitable for client-facing practices.,clinic-target,5/5 (14 reviews),ChIJVRmPKJF3dkgRTHoTTMyL0jY,Woking
Weyside Podiatry,https://weysidepodiatry.co.uk/,Podiatry,,david@weysidepodiatry.co.uk,01276 857474,,"Chobham, Woking GU24 8BZ, UK",,Google Places,9,Podiatry requires a clinical space for client consultations and treatments.,clinic-target,5/5 (2 reviews),ChIJR7owMH55dkgRrbkXYnNJV5M,Woking
TotalFootcareSolutions,https://www.totalfootcaresolutions.com/,Health Clinic,,,01483 968150,,"Shores Rd, Woking GU21 4BY, UK",,Google Places,9,"Health clinic providing clinical services, suitable for client-facing practices.",clinic-target,,ChIJ27kYiy_ZdUgRNhHbbfsZqas,Woking
Podiatry Foot Clinic - West Byfleet,https://privategpclinic.co.uk/podiatry/,Podiatry,,,01932 344004,,"Health Centre, West Byfleet KT14 6DH, UK",,Google Places,9,Podiatry requires a clinical space for patient consultations and treatments.,clinic-target,,ChIJzRCJoQvZdUgRLohR1ecrQlc,Woking
Bedser Hub,http://www.nwsurreyccg.nhs.uk/localityhubs,Health Clinic,,,01483 545300,,"Heathside Rd, Woking GU22 7HS, UK",,Google Places,2,"NHS clinic, not suitable for private professional space",clinic-target,4/5 (7 reviews),ChIJNU2b_CXYdUgRagIDNyjVW90,Woking
Tranquillum Therapy,https://tranquillumtherapy.co.uk/,Therapy,,sheila@tranquillumtherapy.co.uk,07983 778488,,"2 Wyndham Rd, Woking GU21 3DS, UK",,Google Places,9,Suitable for client-facing health and wellness practices,wellness,5/5 (22 reviews),ChIJCw8E9415dkgRKsh4v9smpdg,Woking
Hear for you counselling,https://hearforyou.net/,Mental health professionals,,,07726 190087,,"Knaphill, Woking GU21 2AH, UK",,Google Places,9,Counselling services require a quiet and professional space for client interactions.,wellness,5/5 (17 reviews),ChIJNdA1-zbXdUgR0cIoLDBKFd0,Woking
Craig Coventry Counselling and Psychotherapy In Woking And Guildford,http://www.craigcoventrycounselling.co.uk/,Psychotherapy,,,07470 514551,,"10 Chertsey Rd, Woking GU21 5AB, UK",,Google Places,9,Ideal for client-facing therapy sessions in a professional space,wellness,,ChIJmRgEqybYdUgRzrOXATucjzc,Woking
Just Us Therapy,http://www.justustherapy.com/,Psychotherapy,,,07487 681771,,"10 Chertsey Rd, Woking GU21 5AB, UK",,Google Places,9,Suitable for client-facing therapeutic practices,wellness,,ChIJC-R5b-vXdUgRRvYEvrb0dGE,Woking
Fresh Focus Therapy,https://www.freshfocustherapy.com/,Therapy,,,07564 054743,,"St John's, Woking GU21 7QR, UK",,Google Places,9,"Fresh Focus Therapy provides therapeutic services, making it highly suitable for a client-facing health/wellness practice.",wellness,5/5 (17 reviews),ChIJ9R0eWP3jwIARSK_jnkvjcjA,Woking
Alina Bejan - Psychology / Psychotherapy,,Psychotherapy,,,07594 886002,,"Goldsworth Park, Woking GU21 3AR, UK",,Google Places,9,Ideal for client-facing mental health services in a quiet space,wellness,5/5 (5 reviews),ChIJfzKdbvnXdUgRIMbXUGOws1M,Woking
Tranquility Hypnotherapy Clinic,http://www.tranquilityhypnotherapy.co.uk/,Hypnotherapy,,diccon@tranquilityhypnotherapy.co.uk,07926 402611,,"44 Goldsworth Rd, Woking GU21 6LE, UK",,Google Places,9,"Hypnotherapy requires a quiet, professional space for client sessions.",wellness,5/5 (4 reviews),ChIJ4UZ6s57XdUgR8PrO-YF-0OE,Woking
"Ennia Practice Counselling Woking, Guildford, Chobham, Surrey",,Mental Health,,,07554 282607,,"5 High St, Woking GU21 6BH, UK",,Google Places,9,"Counselling services require a quiet, professional space for client interactions.",wellness,,ChIJd87IMMzZdUgRw3cGd-LfBXI,Woking
Maria Casson Psychotherapist,https://www.mind-diagnostics.org/listing/192842-Maria-Casson-Greco,Mental Health,,,07925 414487,,"Mayford, Woking GU22 0PN, UK",,Google Places,9,Psychotherapist suitable for client-facing health practice,wellness,,ChIJBw6BRrDXdUgReDyrMvvmYpA,Woking
Marian Ryan,http://www.marianryan.co.uk/,Massage Therapy,,,07923 840944,,"6 The Hollands, Woking GU22 7SP, UK",,Google Places,9,"Massage therapy requires a quiet, professional space for client sessions.",wellness,5/5 (11 reviews),ChIJvdPJ_SfYdUgRxIQdVsjr5hw,Woking
Woking Counselling Support,https://www.wokingcounsellingsupport.co.uk/,Counselling,,,07495 267944,,"Mayford, Woking GU22 0NQ, UK",,Google Places,9,"Counselling services require a quiet, professional space for client sessions.",wellness,,ChIJD52Lk27XdUgRjtjd31zlLFs,Woking
Jennifer Gibbs Counselling & Psychotherapy,http://www.jennifergibbs.co.uk/,Counselling & Psychotherapy,,,07967 020710,,"Kingfield Rd, Woking GU22 9AA, UK",,Google Places,9,Suitable for client-facing mental health services in a quiet professional space.,wellness,,ChIJ43psdrfRdUgRVhH-Bh4-k54,Woking
Relate West Surrey,http://relatewestsurrey.org.uk/,Mental Health Services,,,01483 602998,,"Westfield, Woking GU22 9PB, UK",,Google Places,8,"Relate West Surrey provides therapeutic services, making it suitable for a client-facing health practice.",wellness,3/5 (4 reviews),ChIJj1rByCbYdUgRhdDiu-XKWxE,Woking
Oliver Baum,http://www.oliverbaum.co.uk/,Health & Wellness,,Therapyoliver@oliverbaum.co.uk,07779 671513,https://www.linkedin.com/in/oliver-baum-44431025/,"Hermitage Bridge, Woking GU21 8XP, UK",,Google Places,7,"Wellness-focused business, likely suitable for client-facing services but may need to assess space requirements.",wellness,5/5 (1 reviews),ChIJ9wpm2VrXdUgRGerEgnASPjQ,Woking
"Raphael Lopez de Soto, Psychotherapist",http://raphaellopezdesoto.com/,Psychotherapy,,,01483 724300,,"3a Oriental Rd, Woking GU22 7AH, UK",,Google Places,9,Ideal for client-facing therapy sessions in a quiet space,wellness,,ChIJz7jC_SPYdUgRehJLMYypTZ4,Woking
James Golding Hypnotherapy,http://www.jamesgoldinghypnotherapy.com/,Hypnotherapy,,,01932 341055,,"Heathside Road, Woking GU22 7QP, UK",,Google Places,8,Hypnotherapy is a client-facing health practice that fits well in a professional and quiet space.,wellness,5/5 (3 reviews),ChIJ2zxEFSbYdUgRzuQcUIoBGN8,Woking
Mind Therapy,https://cbtsamaira.wixsite.com/therapy,Psychotherapy,,,07353 990952,,"24 The Grove, Woking GU21 4AE, UK",,Google Places,9,"Mind Therapy provides therapeutic services, making it highly suitable for a client-facing health/wellness practice.",wellness,,ChIJ2aDF_aHZdUgRqFyJ1-_t1zs,Woking
Safe Haven Woking,https://www.sabp.nhs.uk/our-services/mental-health/safe-havens/SafeHavenWoking,Mental Health Services,,,,http://www.linkedin.com/company/nhs-surrey-and-borders-partnership,"Westfield, Woking GU22 9PB, UK",,Google Places,1,"NHS or public sector clinic, not suitable for private space",clinic-target,4.2/5 (21 reviews),ChIJ9Y55eyfYdUgRy6v1zTxx6tE,Woking
Cygnet Hospital Woking,https://www.cygnetgroup.com/locations/cygnet-hospital-woking/,hospital,,,01483 795100,,"Knaphill, Woking GU21 2QS, UK",,Google Places,1,"Large hospital facility, not suitable for small professional space",clinic-target,2.7/5 (51 reviews),ChIJ6Q7GxU7WdUgRD8wpPLv9SAs,Woking
Priory Woking - addiction rehab and mental health treatment,https://www.priorygroup.com/locations/priory-hospital-woking?utm_source=google_my_business&utm_medium=organic&utm_campaign=private&utm_content=priory-hospital-woking,mental health treatment,,,01483 489211,,"Knaphill, Woking GU21 2QF, UK",,Google Places,5,Larger practice that may outgrow the space,clinic-target,4/5 (43 reviews),ChIJaatzEkbWdUgRJrrarMjw1J8,Woking
Priory Life Works House - Residential Addiction Treatment in Surrey,https://www.priorygroup.com/locations/life-works?utm_source=google_my_business&utm_medium=organic&utm_campaign=private&utm_content=life-works,Residential Addiction Treatment,,,01483 757572,,"High St, Old Woking, Woking GU22 8LB",,Google Places,4,Large facility likely requires more space than Unit 8 offers,wellness,3.6/5 (18 reviews),ChIJ5zsOI7XZdUgR-nVDg8xo9Mk,Woking
MK Surrey Counselling,,Counselling,,,07735 602788,,"Chertsey Rd, Woking GU21 5AB, UK",,Google Places,9,"Counselling services require a quiet, professional space for client sessions.",wellness,,ChIJu9bc41PZdUgRwYIgYBuUd6Q,Woking
Cygnet Lodge Woking,https://www.cygnetgroup.com/locations/cygnet-lodge-woking/,Health & Wellness,,,01483 289999,,"Knaphill, Woking GU21 2FD, UK",,Google Places,5,Larger practice that may outgrow the space,wellness,2.6/5 (10 reviews),ChIJlzZesk_WdUgRrQQtfJ68z7A,Woking
Willow House - Sanctuary Supported Living,https://www.sanctuary-supported-living.co.uk/find-services/mental-health/surrey/willow-house,Mental Health Services,,,01483 723837,https://www.linkedin.com/company/sanctuary-supported-living/?originalSubdomain=uk,"Triggs Ln, Woking GU21 7PL, UK",,Google Places,8,Suitable for mental health support services in a professional setting,wellness,,ChIJFfEklWrXdUgREqdo9Ml-OAA,Woking
The Healing Space,https://www.thehealingspacesurrey.com/,Health & Wellness,,calvert253@btinternet.com,01483 770529,,"Crofton Healthcare, Woking GU22 0EX, UK",,Google Places,9,"The Healing Space focuses on health and wellness, making it suitable for client-facing practices.",wellness,3/5 (2 reviews),ChIJvbPOWZvXdUgRxeI3JEoZd68,Woking
SearchLight Counselling & Therapy,http://www.searchlightcounsellingandtherapy.org.uk/,Counselling & Therapy,,,01483 602998,,"Westfield, Woking GU22 9PB, UK",,Google Places,9,"Counselling and therapy services fit well in a quiet, professional space for client-facing practices.",wellness,,ChIJD7XdlETZdUgRzn0_Fzwq_-0,Woking
Pat Church Counselling,http://patchurchcounselling.co.uk/,Mental health professionals,,,01932 351429,,"Church Street, Old Woking, Woking GU22 9JE",,Google Places,9,"Counselling is a client-facing health practice that fits well in a quiet, professional space.",wellness,,ChIJscg0brXZdUgRRn8RHk42uwQ,Woking
My Planet Health Counselling,http://www.myplanethealth.co.uk/,Mental Health,,,07940 526602,,"Send, Surrey GU23 7ET, UK",,Google Places,9,Counselling is a client-facing health practice that fits well in a professional and quiet space.,wellness,5/5 (3 reviews),ChIJbxV6EUjZdUgRbspOG-q8v7o,Woking
Send Therapy Rooms,https://sendtherapyrooms.co.uk/,Physiotherapy,,,,,"Send, Woking GU23 7ET, UK",,Google Places,9,"Physiotherapy requires a clinical space for client treatment, making it highly suitable.",clinic-target,3.8/5 (9 reviews),ChIJxdVudMrZdUgRfLZyMLk0FmQ,Woking
Crisis Plus - Counselling and Psychotherapy,,Counselling and Psychotherapy,,,01276 748023,,"Knaphill, Woking GU21 2BW, UK",,Google Places,9,Suitable for client-facing mental health services in a quiet space.,wellness,,ChIJUe6j4K7XdUgReBe0Vv6q3A8,Woking
Living Therapy Counselling,,Mental Health,,,07768 812476,,"22 Maple Grove, Woking GU22 9PJ, UK",,Google Places,9,Counselling is a client-facing health practice that fits well in a professional and quiet space.,wellness,,ChIJgcjUwX_XdUgRPBfb76ut4RM,Woking
YOGA & PILATES CLASS UFC GYM,https://woking.ufcgym.co.uk/,Yoga and Pilates,,,07377 199908,,"12-14 Victoria Rd, Woking GU22 7PL, UK",,Google Places,6,Yoga studio could fit but may outgrow the space,wellness,5/5 (2 reviews),ChIJg_Ao5OnZdUgR3b2xsKFqIpI,Woking
Becky Tovey Pilates,http://www.beckytoveypilates.co.uk/,Pilates,,,07980 807344,,"5 Harelands Cl, Woking GU21 4NX, UK",,Google Places,8,Small pilates studio suitable for client-facing wellness practices,wellness,5/5 (28 reviews),ChIJFYKOZJfXdUgR2a76IV06DvA,Woking
Luxe Pilates Woking,http://www.luxepilates.com/,Pilates Studio,,info@luxepilates.com,07715 490227,,"Blackhorse Rd, Woking GU22 0QT, UK",,Google Places,7,Suitable for small group classes but may outgrow the space,wellness,5/5 (23 reviews),ChIJCbINn_nXdUgR3-CejcaXxkw,Woking
Body Torque Pilates,http://www.body-torque.com/,Pilates Studio,,,07958 442382,,"Oriental Rd, Woking GU22 7BD, UK",,Google Places,8,Small pilates studio suitable for client-facing wellness practices,wellness,5/5 (12 reviews),ChIJIYqOMbzZdUgR5zfvu24j3Pw,Woking
Pilates Body Centre,http://www.pilatesbodycentre.co.uk/,Pilates/Yoga,,enquiries@pilatesbodycentre.co.uk,01483 906523,,"Mayford Grn, Woking, Mayford",,Google Places,8,Small pilates/yoga studio fits well in a client-facing health/wellness space,wellness,4.8/5 (23 reviews),ChIJbb2sUnDXdUgRMNtIaeEv8_k,Woking
Yoga and Pilates by Shen,https://www.yogabyshen.co.uk/book-a-class,Yoga Studio,,yogabyshen@gmail.com,07960 700630,,"Horsell, Woking GU21 4SS, UK",,Google Places,8,Small yoga studio suitable for group classes in a professional space,wellness,5/5 (79 reviews),ChIJr900XtLXdUgR3tuHfz_hX8A,Woking
Loving-Pilates Jean Androne,https://loving-pilates.com/,Pilates/Yoga Studio,,studio@loving-pilates.com,07879 255227,,"Portland House, 102 Lower Guildford Rd, Knaphill",,Google Places,8,Small pilates/yoga studio suitable for client-facing wellness practices,wellness,5/5 (44 reviews),ChIJY4e41uHXdUgRfxIf-eRgYsw,Woking
"CoreEssentials with Christiane, Pilates is for everyone",https://www.christianeebert.com/,Pilates,,,07863 760394,,"55 Ford Rd, Old Woking, Woking GU22 9HJ",,Google Places,6,"Pilates is a wellness practice, but may require more space for group classes.",wellness,5/5 (8 reviews),ChIJJcTiph7ZdUgRXRhb9G4xWuc,Woking
Karma Yoga and Pilates,http://www.karmayogaandpilates.co.uk/,Yoga and Wellness,,Karmayogapilates@outlook.com,07859 892824,,"Hermitage Rd, Woking GU21 8TL, UK",,Google Places,8,Small yoga studio suitable for group classes in a professional space,wellness,5/5 (87 reviews),ChIJ0VeAUpjXdUgRd-igm0uD66c,Woking
Pilates by George,http://www.pilatesbygeorge.co.uk/,Pilates Studio,,,07775 924804,,"White Rose Ln, Woking GU22 7HA, UK",,Google Places,8,Small pilates studio suitable for client-facing wellness practices,wellness,,ChIJkWsHxCXYdUgRBtnpDZ7mjj8,Woking
Core Value Services,,Yoga Studio,,,07941 220815,,"Board School Rd, Woking GU21 5HD, UK",,Google Places,9,Small yoga studio suitable for group classes in a professional space.,wellness,5/5 (16 reviews),ChIJMVFk5SPYdUgRAWH84iFo2ZY,Woking
Ora Studio (Pilates & Wellness),https://orapilatesstudio.co.uk/,Pilates & Wellness,,,07460 492425,,"Chobham, Woking GU24 8LD, UK",,Google Places,8,"Small pilates studio fits well in a professional, quiet space for group classes.",wellness,5/5 (1 reviews),ChIJSQrNJ055dkgRMKC3KAUTW9g,Woking
Target-Fit Pilates/Sports Therapy/ Menopause Coach/Personal Training,http://www.target-fit.com/,Pilates and Sports Therapy,,,07545 847371,https://www.linkedin.com/in/klaudia-lennard-cel-7a3611b/,"2 Barrens Cl, Woking GU22 7JZ, UK",,Google Places,7,Business offers multiple wellness services but may outgrow the space due to diverse offerings.,wellness,5/5 (29 reviews),ChIJ8UWe1b7QdUgRK5EvrymCJUc,Woking
acb Pilates,http://www.acbpilates.co.uk/,Pilates,,,07956 337231,,"Chobham, Woking GU24 8PD, UK",,Google Places,8,Small pilates studio fits well in a professional space for client-facing wellness practices.,wellness,5/5 (12 reviews),ChIJIRv4nUIRdkgRBYGQi_ZgQu0,Woking
Claire Seager Pilates,https://www.claireseagerpilates.com/,Pilates,,,07986 574986,,"Freshfields, Woking GU24 9NF, UK",,Google Places,8,Small pilates studio suitable for client-facing wellness practices,wellness,5/5 (41 reviews),ChIJUWcSr8DXdUgRUs6RGhNoyiM,Woking
Woking Tai Chi For Health,http://wokingtaichi.org/,Yoga Studio,,,01483 760641,,"White Rose Ln, Woking GU22 7HA, UK",,Google Places,7,Suitable for wellness practices but may need to consider space for group classes.,wellness,5/5 (2 reviews),ChIJkWsHxCXYdUgRuldi3pQhb3M,Woking
Pilates with Lucy Lane,,Pilates Studio,,,07817 622448,,"Byfleet, West Byfleet KT14 7AP, UK",,Google Places,8,Small pilates studio suitable for client-facing wellness practices,wellness,5/5 (11 reviews),ChIJnT5xEvjZdUgR1rQCT7bt1NU,Woking
Reforma Studios,https://www.reformastudios.co.uk/,Fitness & Wellness,,,,,"Ripley, Woking GU23 6AY, UK",,Google Places,4,Focus on fitness may not align with the clinical space needed,wellness,5/5 (7 reviews),ChIJY30yLxHZdUgRnpWXuJLT8ig,Woking
Samanya Yoga Ltd,http://www.samanyayoga.co.uk/,Yoga Studio,,,07801 491395,,"82 Westfield Rd, Woking GU22 9QA, UK",,Google Places,8,Small yoga studio suitable for client-facing wellness practices,wellness,5/5 (15 reviews),ChIJLe0E433XdUgR483MSMbqNSY,Woking
mojoyoga,http://mojoyoga.uk/,Yoga Studio,,,07887 648822,,"Horsell, Woking GU21 4SS, UK",,Google Places,8,Small yoga studio suitable for client-facing wellness practices,wellness,5/5 (16 reviews),ChIJ2ULWyp7XdUgRIFmih5hqyOU,Woking
Just Love Yoga,http://www.justloveyoga.com/,Yoga Studio,,claire@justloveyoga.com,07590 380363,,"Chobham, Woking GU24 8NG, UK",,Google Places,7,"Small yoga studio suitable for group classes, but may have limitations in space for larger groups.",wellness,5/5 (17 reviews),ChIJqTsMdq7XdUgRd4IQ8A05wEo,Woking
Yoga For All - Woking,https://yogaforall-woking.co.uk/,Yoga Studio,,,07710 258290,,"Byfleet, West Byfleet KT14 7LZ, UK",,Google Places,8,Small pilates/yoga studio suitable for group classes,wellness,5/5 (7 reviews),ChIJyVUvcq_YdUgRjXj-4ozdjeg,Woking
adiyog - yoga and well being,https://www.adiyog.co.uk/,Yoga and wellness,,,07887 840463,,"6 Barrens Cl, Woking GU22 7JZ, UK",,Google Places,8,Small yoga studio fits well in a professional space for group classes,wellness,,ChIJywRjUzDYdUgRFxk9ySwNoEU,Woking
